{
  "version": "0.3.0",
  "generated_on": "2026-04-01",
  "catalog_name": "Genesys Cloud Best Practices Catalog",
  "domains": [
    "Queue",
    "API",
    "EdgeSite",
    "Architect",
    "Security",
    "Telephony",
    "DevOps"
  ],
  "catalog": [
    {
      "key": "queue.routing.methods_defined",
      "domain": "Queue",
      "subcategory": "Routing",
      "control_family": "Routing Integrity",
      "pillar": "Operations",
      "report_category": "Queue Governance",
      "title": "Use an intentional routing method",
      "summary": "Each queue should use a routing method explicitly selected for its interaction type and operating model.",
      "why_it_matters": "Routing method selection governs how interactions are assigned and materially affects fairness, skill matching, and service performance.",
      "recommended_state": "Routing method is documented and intentionally selected rather than inherited or left unreviewed.",
      "anti_pattern": "Queues use default or inherited routing without review.",
      "severity": "High",
      "auditability": "Config",
      "tags": [
        "queue",
        "routing",
        "acd"
      ],
      "object_types": [
        "Queue"
      ],
      "source_basis": "uploaded_research",
      "source_refs": [
        "turn1file0"
      ],
      "source_notes": "Research notes reference Standard ACD, Predictive, Preferred Agent, Bullseye, and Conditional Group routing.",
      "source_urls": [],
      "last_verified": "2026-03-31",
      "detection_strategy": "Inspect queue configuration and verify routing method exists and is documented in approved operating standards.",
      "required_inputs": [
        "queue configuration export",
        "queue inventory",
        "governance metadata if available"
      ],
      "logic_hint": "Flag queues missing approved routing metadata or using deprecated/unapproved routing methods.",
      "automatable": true,
      "recommended_action_short": "Review each queue and explicitly confirm its routing method.",
      "recommended_action_detailed": "Inventory all queues, compare configured routing methods to approved standards, and document the business rationale for each exception.",
      "remediation_priority": "P1",
      "rollback_considerations": "Routing changes can affect assignment behavior; review during a controlled change window.",
      "evidence_examples": [
        "Queue export showing routing method",
        "Change ticket documenting rationale"
      ],
      "sample_bad_state": "Queue routing method is inherited or unknown.",
      "sample_good_state": "Queue is documented as Bullseye routing for tiered skill escalation.",
      "owner_role": "Genesys Platform Engineer",
      "owner_team": "Contact Center Engineering",
      "review_cadence": "Quarterly",
      "false_positive_notes": "Some legacy queues may be intentionally frozen pending migration.",
      "exceptions": [
        "Temporary exception during migration or decommissioning."
      ],
      "risk_acceptance_allowed": true,
      "status": "active",
      "introduced_in_version": "0.2.0",
      "review_status": "draft-reviewed"
    },
    {
      "key": "queue.routing.scoring_change_when_empty",
      "domain": "Queue",
      "subcategory": "Routing",
      "control_family": "Routing Integrity",
      "pillar": "Operations",
      "report_category": "Queue Governance",
      "title": "Change scoring only when the queue is empty",
      "summary": "Queue scoring methods should be set at creation time or changed only when no interactions are waiting.",
      "why_it_matters": "Changing scoring during an active backlog can produce unexpected assignment order.",
      "recommended_state": "Scoring changes occur only during no-backlog windows or controlled creation events.",
      "anti_pattern": "Changing scoring while interactions are already waiting in queue.",
      "severity": "High",
      "auditability": "Config+Runtime",
      "tags": [
        "queue",
        "routing",
        "scoring",
        "acd"
      ],
      "object_types": [
        "Queue"
      ],
      "source_basis": "uploaded_research",
      "source_refs": [
        "turn1file0"
      ],
      "source_notes": "Source explicitly notes scoring changes should occur at creation or when queue has no waiting interactions.",
      "source_urls": [],
      "last_verified": "2026-03-31",
      "detection_strategy": "Compare queue routing/scoring change timestamps to queue backlog intervals from metrics or audit logs.",
      "required_inputs": [
        "queue audit logs",
        "queue metrics",
        "queue config history"
      ],
      "logic_hint": "Flag changes where scoring update time overlaps periods with waiting interactions.",
      "automatable": true,
      "recommended_action_short": "Move routing scoring changes to empty-queue windows.",
      "recommended_action_detailed": "Review scoring change history, identify overlap with active queue backlog, and reschedule future changes during maintenance or no-volume windows.",
      "remediation_priority": "P1",
      "rollback_considerations": "Reverting scoring may change assignment ordering; coordinate with operations.",
      "evidence_examples": [
        "Audit log entry for routing change",
        "Queue metric showing active waiting count at same time"
      ],
      "sample_bad_state": "Scoring changed at 10:15 while 18 interactions were waiting.",
      "sample_good_state": "Scoring changed during pre-open window with zero backlog.",
      "owner_role": "Genesys Platform Engineer",
      "owner_team": "Contact Center Engineering",
      "review_cadence": "Monthly",
      "false_positive_notes": "Historical backlog reconstruction may be approximate if metrics retention is incomplete.",
      "exceptions": [
        "Emergency change approved during live incident."
      ],
      "risk_acceptance_allowed": true,
      "status": "active",
      "introduced_in_version": "0.2.0",
      "review_status": "draft-reviewed"
    },
    {
      "key": "queue.skills.use_when_routing_requires_it",
      "domain": "Queue",
      "subcategory": "Skills",
      "control_family": "Routing Integrity",
      "pillar": "Operations",
      "report_category": "Queue Governance",
      "title": "Use skills only where the routing model benefits from them",
      "summary": "Skill tags and ratings should reflect real expertise and support the queue's routing strategy.",
      "why_it_matters": "Inflated or stale skill models create routing noise and false precision.",
      "recommended_state": "Skills are current, limited in scope, and tied to actual routing requirements.",
      "anti_pattern": "Overuse of skills with weak governance or no operational effect.",
      "severity": "Medium",
      "auditability": "Config",
      "tags": [
        "queue",
        "skills",
        "routing"
      ],
      "object_types": [
        "Queue",
        "User"
      ],
      "source_basis": "uploaded_research",
      "source_refs": [
        "turn1file0"
      ],
      "source_notes": "Research notes describe skill tags and ratings as inputs to some routing methods.",
      "source_urls": [],
      "last_verified": "2026-03-31",
      "detection_strategy": "Review queue routing methods and compare configured skills to queue requirements and skill governance standards.",
      "required_inputs": [
        "queue config",
        "user skill profiles",
        "routing standards"
      ],
      "logic_hint": "Flag skills not referenced by any queue logic or with extreme sprawl.",
      "automatable": true,
      "recommended_action_short": "Trim unused or low-value skills.",
      "recommended_action_detailed": "Map each configured skill to a routing use case, remove stale skill assignments, and normalize rating practices.",
      "remediation_priority": "P2",
      "rollback_considerations": "Skill removal can affect staffing coverage; validate before changes.",
      "evidence_examples": [
        "Skill inventory report",
        "Queue routing design documentation"
      ],
      "sample_bad_state": "Agents have dozens of skills with no routing dependence.",
      "sample_good_state": "Only business-relevant skills are assigned and reviewed quarterly.",
      "owner_role": "Workforce or Routing Administrator",
      "owner_team": "Contact Center Operations",
      "review_cadence": "Quarterly",
      "false_positive_notes": "Some queues intentionally keep rarely used specialty skills for surge or exception routing.",
      "exceptions": [
        "Regulatory or language coverage skills retained for contingency."
      ],
      "risk_acceptance_allowed": true,
      "status": "active",
      "introduced_in_version": "0.2.0",
      "review_status": "draft-reviewed"
    },
    {
      "key": "queue.wrapup.division_aligned",
      "domain": "Queue",
      "subcategory": "WrapUp",
      "control_family": "Reporting Quality",
      "pillar": "Operations",
      "report_category": "Queue Governance",
      "title": "Align wrap-up codes to the queue division",
      "summary": "Wrap-up codes assigned to a queue should belong to the same division where possible.",
      "why_it_matters": "Division-aligned wrap-up codes improve report clarity and reduce ambiguous reporting.",
      "recommended_state": "Queue wrap-up codes are division-consistent and intentionally curated.",
      "anti_pattern": "Queues use mixed or unrelated divisional wrap-up codes.",
      "severity": "Medium",
      "auditability": "Config",
      "tags": [
        "queue",
        "wrapup",
        "division",
        "reporting"
      ],
      "object_types": [
        "Queue",
        "WrapUpCode"
      ],
      "source_basis": "uploaded_research",
      "source_refs": [
        "turn1file0"
      ],
      "source_notes": "Source notes recommend adding divisional codes to queues for better reporting.",
      "source_urls": [],
      "last_verified": "2026-03-31",